"Un train transporte {A} passagers entre deux villes distantes de {B} km. Le train consomme {C} litres de diesel par km. Sachant que chaque passager emporte un bagage de {D} kg et qu'il pèse {E} lbs, et que le poids total du train, y compris les passagers et leurs bagages, ne doit pas dépasser {F} tonnes, quelle est la quantité  de diesel que le train peut embarquer en plus de la quantité requise pour ce voyage si la densité du carburant est de {H} kg/l?
(1lbs = {G} kg)",2:({F}-(({A}*{E}*{G})+({A}*{D}))-({E}*{C}*{H}))/{H},"{A}:(700,1000,1);{B}:(500,1500,10);{C}:(2,10,1);{D}:(10,30,1);{E}:(90,200,1);{F}:(80,100,1);{G}:(0.10,0.99,0.01);{H}:(0.10,0.99,0.01)","Pour calculer la quantité maximale de diesel que le train peut embarquer pour ce voyage, nous devons d'abord déterminer le poids total des passagers et de leurs bagages.

Le poids total de leurs bagages est :
{A} passagers x {D} kg par bagage = [{A}*{D}] kg

Le poids total des passagers est de :
{A} passagers x [{E}*{G}] kg ({E} x {G}) = [{A}*{E}*{G}] kg

Le nombre total de passagers est de {A}, donc le poids total de leurs bagages est :
[{A}*{E}*{G}] + [{A}*{D}] = [({A}*{E}*{G})+({A}*{D})]

Calculons ensuite la quantité de carburant requise:
Ditance entre les villes x cosommation = {B} x {C} = [{B}*{C}] litres soit [{B}*{C}*{H}] kg

Maintenant, pour déterminer la quantité de diesel que le train peut embarquer en plus de la quantité minimum:
Masse maximum du train  -  Les passagers et leurs bagages - masse minimum du fuel =
( {F} x 1000 ) - [({A}*{E}*{G})+({A}*{D})] - [{B}*{C}*{H}] = [{F}-(({A}*{E}*{G})+({A}*{D}))-({E}*{C}*{H})] kg soit [(({F}*1000)-(({A}*{E}*{G})+({A}*{D}))-({B}*{C}*{H}))/{H}] litres",2;None:[{I}] L; [{I}+-1] L;[{I}+-2] L;[{I}+-4] L,None
